{
  "$schema": "https://static.modelcontextprotocol.io/schemas/2025-09-29/server.schema.json",
  "name": "io.github.strangeadvancedmarketing/adam-mcp",
  "description": "Exposes Adam Framework vault memory as MCP tools for Claude Desktop, Cursor, and any MCP-compatible client. Three tools: memory_search (keyword search across vault markdown files), memory_get (retrieve a specific file), memory_list (list all memory files). Works with any markdown vault including Obsidian.",
  "repository": {
    "url": "https://github.com/strangeadvancedmarketing/Adam",
    "source": "github"
  },
  "version": "1.0.0",
  "packages": [
    {
      "registryType": "pypi",
      "registryBaseUrl": "https://pypi.org",
      "identifier": "adam-mcp",
      "version": "1.0.0",
      "transport": {
        "type": "stdio"
      },
      "environmentVariables": [
        {
          "name": "ADAM_VAULT_PATH",
          "description": "Path to your vault directory containing markdown memory files. Defaults to ~/AdamsVault/workspace",
          "required": false
        }
      ]
    }
  ]
}